,שם עמודה,מספר תווים
0,מספר תיק ניכויים,9
1,מספר אגיד,2
2,סוג רשומה,2
3,שנת המס המדווחת,4
4,מספר תעודת זהות,9
5,מדינת המוצא של העובד הזר,3
6,מספר דרכון עובד זר,13
7,זיהוי עובד זר,1
8,שם משפחה,20
9,שם פרטי,15
10,רחוב שכונה ומספר בית,20
11,עיר/ישוב,15
12,מיקוד,5
13,מין ,1
14,מצב משפחתי,2
15,תאריך שינוי מצב משפחתי,8
16,מצב משפחתי קודם,2
17,תאריך לידה,8
18,מס תעודת זהות של בן/בת הזוג,9
19,שם פרטי של בן/בת הזוג,15
20,תאריך לידה בן/בת הזוג,8
21,סוג משרה,2
22,תאריך התחלת עבודה אצל המעביד,8
23,פרוט חודשי עבודה,22
24,סהכ חודשי עבודה,2
25,תשלומים  מהם נוכה מס רגיל ולא פורטו בנפרד,10
26,שווי שימוש ברכב,8
27,החזר הוצאות,8
28,שכר שעות נוספות ותשלומים בשל מאמץ מיוחד או ארוע מסוים,8
29,סכום ההפרשה לבטוח אובדן כושר עבודה ממנו נוכה מס,8
30,סכום ההפרשה לקצבה ממנו נוכה מס,8
31,סכום ההפרשה לקרן השתלמות ממנו נוכה מס,8
32,תשלומים שנוכה מהם מס בשיעור מיוחד בהוראת פקיד שומה  או עפי תקנות מס הכנסה ,8
33,מקדמה ששולמה לעובד היוצא לשנת שבתון,8
34,שכר עבודה במשמרות במפעל תעשייתי ממנו נוכה מס מופחת,8
35,שכר עבודה במשמרות במפעל תעשייתי ממנו נוכה מס רגיל,10
36,תשלומים פטורים ממס.,8
37,סהכ המשכורת והתשלומים ,10
38,"הכנסות פטורות ממס, נכה ועוור לפי סעיף 9(5).",8
39,סכום הפרשה לפיצויים ממנו נוכה מס,8
40,FILLER,1
41,ניכוי מכוח סעיף 47א לפקודה בשל תשלום ביטוח לאומי בשל יחיד שמעסיקו אינו חייב בתשלום דמי ביטוח לאומי בעדו והוא חייב בתשלומם לגבי הכנסת העבודה שלו.,6
42,"הסכום שנוכה מהמשכורת או ששילם העובד לקופג לקצבה (עמית עצמאי), אין הפרשת מעביד. ",6
43,הסכום שנוכה מהמשכורת או ששילם העובד לביטוח חיים (עמית עצמאי) אין הפרשת מעביד,6
44,הסכום שנוכה מהמשכורת כהשתתפות בהוצאות מחקר ופתוח,7
45,ניכוי מיוחד לפי אישור פקיד השומה או הנציב,7
46,תשלום לכיסוי הוצאות ,9
47,"הסכום שנוכה מהמשכורת או ששילם העובד לקופג לקצבה (עמית עצמאי) לחישוב זיכוי, אין הפרשת מעביד. ",6
48,עידוד צמיחה,8
49,הסכום שנוכה ממשכורת העובד או ששילם העובד לביטוח שאירים,6
50,ניכוי לימאים,8
51,קוד עולה חדש / תושב חוזר,1
52,נקודות זיכוי לתושב,1
53,חצי נקודת זיכוי לאשה,1
54,האם לבן/בת זוג יש הכנסה,1
55,תאריך עליה,8
56,נקודות זיכוי לעולה חדש (קוד),1
57,מס חודשים,2
58,זיכוי מאושר עי פקיד השומה לעולה חדש,1
59,זיכוי משפחה חד הורית,1
60,זיכוי בגין מזונות לילדים (שאינם בחזקת העובד),1
61,מזונות לגרוש/ה (נשוי/נשואה בשנית),1
62, בן/בת זוג צעיר,1
63,זיכוי בגין תואר אקדמי או לימודי מקצוע,1
64,תאריך זכאות לתואר/לקבלת תואר,8
65,מקיים משק בית משותף עם יחיד,1
66,זיכוי בגין קרוב נטול יכולת (על פי אישור פקיד שומה),1
67,תאריך שחרור משירות חובה/לאומי,8
68,תקופת שירות חובה/לאומי,2
69,נקודות זיכוי לחייל משוחרר (קוד),1
70,מספר חודשים בשנת המס לחייל משוחרר,2
71,מס נקודות זיכוי  משוקלל שניתנו במהלך השנה,4
72,סכום נקודות הזיכוי בשקלים,6
73,מספר יחידות מס,3
74,התואר לפיו ניתן הזיכוי,2
75,ילדים שנולדו בשנת המס,2
76,ילדים שימלאו להם 1-5 בשנת המס,2
77,ילדים שימלאו להם 6-12 בשנת המס,2
78,ילדים שימלאו להם 13-17 בשנת המס,2
79,ילדים שימלאו להם 18 בשנת המס,2
80,ילדים להורה אחד (מתוך הילדים שסומנו בשדה 1),2
81,ילדים להורה אחד (מתוך הילדים שסומנו בשדה 2),2
82,ילדים להורה אחד (מתוך הילדים שסומנו בשדה 3),2
83,ילדים להורה אחד (מתוך הילדים שסומנו בשדה 5),2
84,ילדים להורה אחד (מתוך הילדים שסומנו בשדה 6),2
85,משכורת חוק עבודת נשים שבגינה הופקד לקופת גמל לקצבה.,6
86,משכורת המהווה בסיס להפרשה לקצבה .,8
87,סכום הפרשת המעביד לקופג לקצבה מרכיב התגמולים .,6
88,מספר הקופות להם הפריש המעביד לקצבה.,1
89,משכורת חוק עבודת נשים שבגינה הופקד לקרן השתלמות.,6
90,סכום הפרשת העובד לקצבה ,6
91,משכורת המהווה בסיס להפרשה לקרן השתלמות,8
92,סכום הפרשת המעביד לקרן השתלמות,6
93,סכום הפרשת העובד לקרן השתלמות,6
94,משכורת המהווה בסיס להפרשה לביטוח בגין אובדן כושר עבודה,8
95,סכום הפרשת המעביד לביטוח אובדן כושר עבודה,6
96,סכום שנוכה מהעובד לביטוח אובדן כושר עבודה,6
97,שיעור הפרשת המעביד לבטוח אובדן כושר עבודה מעל התקרה,3
98,סכום הפרשת המעביד לקופג לקצבה מרכיב הפיצויים,6
99,סכום הפרשת המעביד לקופג לקצבה – השלמת התחייבות לפיצויים,6
100,אחוז ההנחה לתושב אזור מיוחד,2
101,מספר חודשים לפיהן ניתן הזיכוי לתושב אזור מיוחד,2
102,המשכורת המיוחדת לאנשי כוחות הבטחון שקיבלו זיכוי ממס,8
103,סכום הזיכוי שניתן בגין משכורת מיוחדת לאנשי כוחו הבטחון,8
104,"סכום הזיכוי בגין אחזקת בן משפחה במוסד, שנקבע עי פקיד שומה  (סכום הזיכוי)",6
105,הסכום שתרם העובד למוסדות מאושרים (מעביד שאושר עי מנהל הרשות),8
106,סכום הזיכוי בגין תרומות (לפי אישור פקיד שומה ),6
107,"סכום  זיכוי מיוחד (למעט תרומות או אחזקת קרוב במוסד), שניתן עי פקיד השומה או הנציב",6
108,קוד תקרה לפיה ניתן הזיכוי,2
109,מספר עובד במפעל,9
110,שעור מס מיוחד עי פקיד השומה או עפי תקנות מס הכנסה  שנוכה מהתשלומים שפורטו בשדה 34.,2
111,מס שולי של העובד,2
112,המעביד ערך את תאום המס של העובד,1
113,סהכ מס הכנסה שנוכה,9
114,מס יסף – מס הכנסות גבוהות,6
115,ניכוי דמי טיפול ארגוני,5
116,קוד הענף שבו מועסק העובד הזר,2
117,"קוד זיהוי לעובד חבר קיבוץ, מושב שיתופי",1
118,אחוז פטור שחושב לקצבה ניתן על פי,1
119,אחוז פטור שחושב לקצבה,3
120,סכום ההטבה להקטנת עלויות השכר לפי חוק אזור סחר חופשי  אילת,8
121,ציין האם העובד בעל שליטה או קרוב על פי חוק אזור סחר חופשי  אילת,1
122,תשלומים פטורים ממס מעסיקים,9
123,תשלומים פטורים ממס שכר,9
124,סכום התמורה,6
125,תאריך היוון,8
126,מספר שנים לגביהן בוצע ההיוון,2
127,קצבה מלאה לפני ההיוון,7
128,אישור עבודה לעובד זר,1
129,האם העובד מילא טופס 101 אלקטרוני,1
130,תשלומים פטורים מדמי בטוח לאומי (שאינם נכללים בטופס 102),8
131,דמי בטוח לאומי לא כולל מס בריאות המנוכים מהעובד,8
132,דמי בטוח בריאות המנוכים מהעובד,8
133,תשלומים החייבים בדמי בטוח לאומי עד למקסימום שפורסם,8
134,תשלומים פטורים מדמי בטוח לאומי מעל לתקרה שפורסמה,8
135,מקור תשלום אובדן כושר עבודה,1
136,סוג הקצבה המשולמת,1
137,סוג המעסיק לעניין הביטוח הלאומי,1
138,בעל שליטה לעניין המוסד לביטוח לאומי ,4
139,FILLER ,1
140,סכום הפרשת מעביד לביל,6
141,מספר תיק ניכויים של בל,11
142,ברוטו הפרשים שנים קודמות ,8
143,שנת שיוך לתשלום הפרשים משדה 133ב,4
144,שכר נוסף,8
145,משכורת בסיסית לעובד ישראלי בחול,8
146,הוצאות דיור לעובד ישראלי בחול,7
147,הוצאות רפואיות בחול,7
148,הוצאות שכר לימוד בחול,7
149,הוצאות אשל בחול במדינת השרות,7
150,הוצאות אשל בחול מחוץ למדינת השרות,7
151,הוצאות ביקור מולדת,7
152,מספר מפעל,5
